{
  "schema_version": "1.0.0",
  "kind": "conformance-suite-result",
  "suite": "JCT-VC-HEVC_V1",
  "suite_key": "hevc",
  "mode": "hardware",
  "complete": true,
  "abort": null,
  "passed": 1,
  "total": 2,
  "passing_frames": 1,
  "high10": "off",
  "profile_mismatch": false,
  "subset": null,
  "provenance": {
    "driver_version": "1.3.r11",
    "machine": "fixture"
  },
  "command": {
    "redacted": true,
    "argv": [
      "frame-check",
      "vaapi",
      "<redacted>",
      "yuv420p"
    ]
  },
  "vectors": [
    {
      "name": "KEEP_A",
      "success": true,
      "category": "hardware_pass",
      "expected_md5": "aa",
      "actual_md5": "aa",
      "frames": 1,
      "native_sizes": [
        "16x16"
      ]
    },
    {
      "name": "FAIL_B",
      "success": false,
      "category": "decode_error",
      "expected_md5": "bb",
      "actual_md5": null,
      "frames": 0,
      "native_sizes": []
    }
  ]
}
